企业名称,状态,网址
安徽省宁国市金华银电机有限公司,0,https://www.tianyancha.com/company/513677889
安徽宁昌塑料包装有限公司,0,https://www.tianyancha.com/company/497718508
安徽省安东铸造有限公司,1,-
安徽安凯汽车股份有限公司,0,https://www.tianyancha.com/company/283155534
安徽安可福食品有限公司,0,https://www.tianyancha.com/company/392045806
安徽省安国渔具有限公司,0,https://www.tianyancha.com/company/778465207
安徽安太电力设备有限公司,1,-
安徽安庆南风日化有限公司,0,https://www.tianyancha.com/company/501463163
安徽安庆皖江发电有限公司,0,https://www.tianyancha.com/company/531165993
安徽安泰新型包装材料有限公司,0,https://www.tianyancha.com/company/475267761
安徽安科余良卿药业有限公司,0,https://www.tianyancha.com/company/473318944
安徽安科恒益药业有限公司,0,https://www.tianyancha.com/company/536268687
安徽安科生物工程（集团）股份有限公司,0,https://www.tianyancha.com/company/27420090
安徽安能热电股份有限公司,0,https://www.tianyancha.com/company/977952201
安徽宏宇竹木制品有限公司,1,-
安徽宏晶新材料股份有限公司,0,https://www.tianyancha.com/company/538059189
安徽宏源特种电缆集团有限公司,0,https://www.tianyancha.com/company/524492309
安徽宏祥丝绸织造有限公司,0,https://www.tianyancha.com/company/711488284
安徽宏进钢结构件制造有限公司,0,https://www.tianyancha.com/company/363779217
安徽省定兴电缆有限公司,0,https://www.tianyancha.com/company/350726939
安徽宜德电子有限公司,0,https://www.tianyancha.com/company/537108290
安徽宝祥食品有限公司,0,https://www.tianyancha.com/company/533681153
安徽宝龙电器有限公司,0,https://www.tianyancha.com/company/513825520
安徽省宣城市双乐混凝土有限公司,0,https://www.tianyancha.com/company/385827813
安徽家乐米业有限公司,0,https://www.tianyancha.com/company/811465050
安徽家和兴食品有限公司,0,https://www.tianyancha.com/company/519163877
安徽宿州科技食品有限公司,0,https://www.tianyancha.com/company/420086446
安徽富利达织造有限公司,1,-
安徽省小山卫生材料有限公司,0,https://www.tianyancha.com/company/610944276
安徽省尚展模具工业有限公司,0,https://www.tianyancha.com/company/294553622
安徽山鹰纸业股份有限公司,0,https://www.tianyancha.com/company/3073987594
安徽屹东水泥制造有限公司,0,https://www.tianyancha.com/company/291588182
安徽巢东水泥股份有限公司,0,https://www.tianyancha.com/company/2349394141
安徽省巢湖东关兴巢水泥有限公司,0,https://www.tianyancha.com/company/2328562628
安徽巢湖南方膜业有限公司,0,https://www.tianyancha.com/company/700230635
安徽省巢湖铸造厂有限公司,0,https://www.tianyancha.com/company/498962266
安徽工业大学机电总厂,1,-
安徽巨森电器有限公司,0,https://www.tianyancha.com/company/288717957
安徽帅旺食品有限公司,0,https://www.tianyancha.com/company/287943833
安徽常福混凝土有限公司,0,https://www.tianyancha.com/company/660387919
安徽省广德新丰丝绸有限公司,0,https://www.tianyancha.com/company/537334799
安徽省广德新龙粮食油脂有限公司,0,https://www.tianyancha.com/company/642107659
安徽省庐江龙桥矿业有限公司,0,https://www.tianyancha.com/company/365686091
安徽康佳电子有限公司,0,https://www.tianyancha.com/company/512231285
安徽康嘉塑胶建材有限公司,0,https://www.tianyancha.com/company/371971550
安徽省康达医疗用品集团,2,-
安徽省建筑机械厂,1,-
安徽省微威胶件有限公司,0,https://www.tianyancha.com/company/274307057
安徽省德力玻璃器皿有限公司,0,https://www.tianyancha.com/company/34240358
安徽省怀宁县金诚塑料有限公司,2,-
安徽省怀宁县龙洲实业有限公司,0,https://www.tianyancha.com/company/689643982
安徽恒力电业有限公司,0,https://www.tianyancha.com/company/519453465
安徽恒源技研化工有限公司,0,https://www.tianyancha.com/company/420817685
安徽恒盛实业有限公司,0,https://www.tianyancha.com/company/487485191
安徽恒裕酿造有限公司,0,https://www.tianyancha.com/company/264831214
安徽意义环保设备有限公司,0,https://www.tianyancha.com/company/262484612
安徽意通电力设备有限公司,0,https://www.tianyancha.com/company/656445021
安徽扬子绿色包装有限公司,0,https://www.tianyancha.com/company/608172072
安徽省振华模具标准件有限公司,1,-
安徽振富棉纱有限公司,2,-
安徽攀登机械股份有限公司,0,https://www.tianyancha.com/company/220216847
安徽文王酿酒股份有限公司,0,https://www.tianyancha.com/company/479149188
安徽新亚特电缆集团有限公司,0,https://www.tianyancha.com/company/243846673
安徽新力电气设备有限公司,0,https://www.tianyancha.com/company/588797981
安徽新华印刷股份有限公司,0,https://www.tianyancha.com/company/303998332
安徽新思维食品有限公司,0,https://www.tianyancha.com/company/510995104
安徽新林时装有限公司,1,-
安徽新港混凝土有限公司,0,https://www.tianyancha.com/company/688662803
安徽新源热电有限公司,0,https://www.tianyancha.com/company/533891003
安徽新联商品混凝土有限公司,0,https://www.tianyancha.com/company/435359134
安徽新鸿伟钢结构有限公司,0,https://www.tianyancha.com/company/270274177
安徽省无为县光明体育用品有限公司,0,https://www.tianyancha.com/company/691225856
安徽省无为煤矿机械制造有限公司,0,https://www.tianyancha.com/company/437130898
安徽旭日光盘有限公司,0,https://www.tianyancha.com/company/3019320447
安徽昊源化工集团有限公司,0,https://www.tianyancha.com/company/26103522
安徽昌龙水泥有限公司,0,https://www.tianyancha.com/company/546229518
安徽省明美矿物有限公司,0,https://www.tianyancha.com/company/394799259
安徽明都电力线缆有限公司,0,https://www.tianyancha.com/company/246455641
安徽星马汽车股份有限公司,0,https://www.tianyancha.com/company/503418503
安徽普爱饲料有限公司,1,-
安徽晶菱机床制造有限公司,0,https://www.tianyancha.com/company/238842080
安徽省望宇纺织股份有限公司,2,-
安徽朝山新材料股份有限公司,0,https://www.tianyancha.com/company/239191695
安徽朱家桥水泥有限公司,1,-
安徽杭萧钢结构有限公司,0,https://www.tianyancha.com/company/2963762797
安徽枞阳海螺水泥股份有限公司,0,https://www.tianyancha.com/company/558559969
安徽省桐城市恒昌实业有限公司,0,https://www.tianyancha.com/company/305199333
安徽桑尼生物技术研究所,0,https://www.tianyancha.com/company/503849947
安徽梯西埃姆叉车有限公司,1,-
安徽森源电器有限公司,0,https://www.tianyancha.com/company/173373322
安徽欣意电缆有限公司,0,https://www.tianyancha.com/company/331947639
安徽正元机械有限公司,0,https://www.tianyancha.com/company/527622629
安徽武鹰制衣有限公司,0,https://www.tianyancha.com/company/535715244
安徽省毛尖山水电站,0,https://www.tianyancha.com/company/217812806
安徽省水泥制品厂,0,https://www.tianyancha.com/company/1094343841
安徽永生堂药业有限公司,0,https://www.tianyancha.com/company/433205863
安徽省求精机械制造有限公司,0,https://www.tianyancha.com/company/382959047
安徽汇利服饰有限公司,1,-
安徽江中高邦制药有限公司,0,https://www.tianyancha.com/company/649813587
安徽省江北机械厂,1,-
安徽省江桥羽毛有限公司,0,https://www.tianyancha.com/company/213172981
安徽江淮专用汽车有限公司,0,https://www.tianyancha.com/company/615093026
安徽江淮客车有限公司,0,https://www.tianyancha.com/company/480774471
安徽江淮汽车股份有限公司,0,https://www.tianyancha.com/company/2943787214
安徽江淮泵阀有限公司,0,https://www.tianyancha.com/company/479576750
安徽江淮电缆集团有限公司,0,https://www.tianyancha.com/company/540219637
安徽江淮福臻汽车技术服务有限公司,1,-
安徽江淮起重运输机械有限公司,0,https://www.tianyancha.com/company/694160046
安徽江淮银联重型工程机械有限公司,0,https://www.tianyancha.com/company/700011368
安徽省江通纺织有限公司,0,https://www.tianyancha.com/company/711644544
安徽池州家用机床股份有限公司,0,https://www.tianyancha.com/company/333975436
安徽省池州新赛德化工有限公司,0,https://www.tianyancha.com/company/79477551
安徽省池州精晶冶化有限公司,0,https://www.tianyancha.com/company/1021816616
安徽泰和机械有限公司,0,https://www.tianyancha.com/company/697789215
安徽泾县光玉实业有限公司,0,https://www.tianyancha.com/company/535440255
安徽省泾县双联工艺品有限公司,0,https://www.tianyancha.com/company/531963876
安徽省泾县春雅工艺美术用品有限公司,0,https://www.tianyancha.com/company/563211527
安徽省泾县艺达笔刷有限公司,0,https://www.tianyancha.com/company/697066551
安徽省泾县金隆纸业有限公司,0,https://www.tianyancha.com/company/549110075
安徽省泾县鑫源茧丝绸有限公司,0,https://www.tianyancha.com/company/649352586
安徽济人药业有限公司,0,https://www.tianyancha.com/company/5607801078
安徽浩缘朋制衣有限公司,0,https://www.tianyancha.com/company/204578011
安徽浪森肥业有限公司,0,https://www.tianyancha.com/company/204487312
安徽海天电器有限公司,0,https://www.tianyancha.com/company/518304082
安徽海特微波通信有限公司,0,https://www.tianyancha.com/company/210702185
安徽海螺彩色印刷有限公司,1,-
安徽润发面业有限公司,0,https://www.tianyancha.com/company/670307530
安徽省润基水泥有限公司,0,https://www.tianyancha.com/company/3451370205
安徽淮化集团有限公司,1,-
安徽淮化集团泉山化工有限公司,0,https://www.tianyancha.com/company/716151789
安徽淮北天宏集团实业有限公司,0,https://www.tianyancha.com/company/438786886
安徽淮南平圩发电有限公司,0,https://www.tianyancha.com/company/577236423
安徽省湖滨机械厂,0,https://www.tianyancha.com/company/366260709
安徽源光电器有限公司,0,https://www.tianyancha.com/company/200015572
安徽省滁州热电厂,0,https://www.tianyancha.com/company/362604723
安徽省潜山县八一纺织器材厂,0,https://www.tianyancha.com/company/363285512
安徽省潜山县包装制品有限公司,0,https://www.tianyancha.com/company/377494089
安徽省潜山磁性材料有限公司,0,https://www.tianyancha.com/company/291902602
安徽省热力电缆有限公司,0,https://www.tianyancha.com/company/432066788
安徽燎原化工有限公司,0,https://www.tianyancha.com/company/487371460
安徽爱德夏汽车零部件有限公司,0,https://www.tianyancha.com/company/272940891
安徽特力电缆有限公司,0,https://www.tianyancha.com/company/495665763
安徽独秀纺织有限公司,1,-
安徽猎塔电缆集团有限公司,0,https://www.tianyancha.com/company/487387435
安徽省玉桐制刷有限公司,0,https://www.tianyancha.com/company/507243784
安徽环宇公路沥青材料有限公司,0,https://www.tianyancha.com/company/524769823
安徽环宇电缆集团有限公司,0,https://www.tianyancha.com/company/605055549
安徽环球药业股份有限公司,0,https://www.tianyancha.com/company/435099995
安徽省琅琊山矿业总公司,0,https://www.tianyancha.com/company/390918816
安徽琪嘉日化有限公司,0,https://www.tianyancha.com/company/2312074574
安徽申马运动用品有限公司,0,https://www.tianyancha.com/company/616426397
安徽省电力公司,0,https://www.tianyancha.com/company/3101315011
安徽电力东至供电有限公司,0,https://www.tianyancha.com/company/4455261064
安徽电力休宁供电有限公司,0,https://www.tianyancha.com/company/4465155523
安徽电力修造厂,1,-
安徽省电力利辛供电有限公司,2,-
安徽电力墉桥供电有限公司,2,-
安徽电力太和供电有限公司,2,-
安徽电力宁国供电有限公司,2,-
安徽电力定远供电有限公司,2,-
安徽电力寿县供电有限公司,2,-
安徽电力岳西供电有限公司,2,-
安徽电力广德供电有限公司,2,-
安徽电力明光供电有限公司,2,-
安徽电力望江县供电有限公司,2,-
安徽电力枞阳供电有限公司,2,-
安徽电力泾县供电有限公司,2,-
安徽电力涡阳供电有限公司,2,-
安徽电力股份有限公司淮南田家庵发电厂,0,https://www.tianyancha.com/company/584019624
安徽电力潘集供电有限公司,2,-
安徽电力濉溪供电有限公司,2,-
安徽电力灵璧供电有限公司,2,-
安徽电力石台供电有限公司,2,-
安徽电力砀山供电有限公司,2,-
安徽电力祁门供电有限公司,2,-
安徽电力舒城供电有限公司,2,-
安徽电力谢桥供电有限公司,2,-
安徽电力贵池供电有限公司,2,-
安徽省电力公司阜阳供电公司,0,https://www.tianyancha.com/company/3117585618
安徽电力霍山供电有限公司,2,-
安徽电力霍邱供电有限公司,2,-
安徽电力青阳供电有限公司,2,-
安徽电力颍上供电有限公司,2,-
安徽电力黄山区供电有限公司,1,-
安徽电力黟县供电有限公司,2,-
安徽电子计算机厂,0,https://www.tianyancha.com/company/3188564910
安徽电缆股份有限公司,0,https://www.tianyancha.com/company/420282170
安徽电联票务印刷有限公司,0,https://www.tianyancha.com/company/423559724
安徽白帝乳业有限公司,1,-
安徽省白湖电声器材厂,1,-
安徽省白湖阀门厂有限公司,0,https://www.tianyancha.com/company/383993556
安徽百世佳包装有限公司,0,https://www.tianyancha.com/company/540656912
安徽百信饲料有限公司,0,https://www.tianyancha.com/company/507432158
安徽省皖北煤电集团有限公司,0,https://www.tianyancha.com/company/2962801
安徽省皖北药业股份有限公司,0,https://www.tianyancha.com/company/1554527424
安徽皖宝矿业股份有限公司,0,https://www.tianyancha.com/company/373409315
安徽省皖江钢构有限公司,0,https://www.tianyancha.com/company/686906059
安徽省皖淮机械厂,0,https://www.tianyancha.com/company/581225922
安徽皖维高新材料股份有限公司,0,https://www.tianyancha.com/company/141013751
安徽皖酒制造集团有限公司,0,https://www.tianyancha.com/company/145813505
安徽益益乳业有限公司,0,https://www.tianyancha.com/company/306578505
安徽真心食品有限公司,0,https://www.tianyancha.com/company/169207291
安徽省砀山兴达罐业食品有限公司,0,https://www.tianyancha.com/company/360327594
安徽省碧绿春酿酒有限公司,0,https://www.tianyancha.com/company/652825118
安徽省祁门县黄山电器有限公司,0,https://www.tianyancha.com/company/638548469
安徽神虹变压器有限公司,0,https://www.tianyancha.com/company/552587007
安徽福康药业有限公司,1,-
安徽省福润肉类加工有限公司,0,https://www.tianyancha.com/company/193093249
安徽科信包装有限公司,0,https://www.tianyancha.com/company/1059950019
安徽科力信息产业有限公司,0,https://www.tianyancha.com/company/12701781
安徽米特吉机械股份有限公司,0,https://www.tianyancha.com/company/3202348990
安徽精方药业股份有限公司,0,https://www.tianyancha.com/company/505296399
安徽精科机器有限公司,0,https://www.tianyancha.com/company/552840618
安徽紫金鹏印务有限公司,0,https://www.tianyancha.com/company/675195530
安徽繁华电缆有限公司,1,-
安徽红利来服装有限公司,0,https://www.tianyancha.com/company/2954894075
安徽省红星机械厂,2,-
安徽红星药业有限公司,0,https://www.tianyancha.com/company/2316475612
安徽纽泰克锁具有限公司,0,https://www.tianyancha.com/company/504975720
安徽经华包装有限公司,0,https://www.tianyancha.com/company/298681291
安徽绚丽时装有限公司,0,https://www.tianyancha.com/company/482639485
安徽继远电网技术有限公司,0,https://www.tianyancha.com/company/579542382
安徽省绩溪县华林玻璃纤维有限公司,0,https://www.tianyancha.com/company/2352475697
安徽绿一粮油集团,0,https://www.tianyancha.com/company/1037077776
安徽美佳印务有限公司,0,https://www.tianyancha.com/company/1098432807
安徽美祥实业有限公司,0,https://www.tianyancha.com/company/940367953
安徽省联河米业有限公司,0,https://www.tianyancha.com/company/2867598140
安徽省肥东宏达轴承配件有限公司,0,https://www.tianyancha.com/company/348336136
安徽省腾农肥业有限公司,0,https://www.tianyancha.com/company/497655827
安徽省舒城三乐童车有限公司,0,https://www.tianyancha.com/company/590379480
安徽省舒城久富田经济发展有限公司,0,https://www.tianyancha.com/company/524858005
安徽省舒城华竹实业有限公司,0,https://www.tianyancha.com/company/435265394
安徽省舒城县舒雅制衣有限公司,1,-
安徽省舒城县青云精米加工有限公司,0,https://www.tianyancha.com/company/805220509
安徽省舒城县鸿大农机有限公司,0,https://www.tianyancha.com/company/473370162
安徽航佳丝绸集团实业有限公司,0,https://www.tianyancha.com/company/709048323
安徽省航天机床制造股份有限公司,0,https://www.tianyancha.com/company/420284025
安徽航天电缆集团有限公司,0,https://www.tianyancha.com/company/506680078
安徽英发电子有限公司,0,https://www.tianyancha.com/company/492969374
安徽荣第羽绒制品有限公司,0,https://www.tianyancha.com/company/367218574
安徽荻港海螺水泥股份有限公司,0,https://www.tianyancha.com/company/468724059
安徽莱恩电泵有限公司,0,https://www.tianyancha.com/company/336297787
安徽省菲特科技股份有限公司,0,https://www.tianyancha.com/company/398454021
安徽蓝天巾被有限公司,0,https://www.tianyancha.com/company/362502632
安徽省蓝神珠宝有限公司,0,https://www.tianyancha.com/company/486929361
安徽省蓼源贸易有限公司,0,https://www.tianyancha.com/company/586764390
安徽裕华纺织有限公司,0,https://www.tianyancha.com/company/566492769
安徽裕和电缆电器有限公司,0,https://www.tianyancha.com/company/638292259
安徽省诚信食品有限公司,0,https://www.tianyancha.com/company/495631931
安徽象牙米业有限公司,0,https://www.tianyancha.com/company/492359926
安徽赛普电气有限公司,0,https://www.tianyancha.com/company/492704431
安徽车桥有限公司,0,https://www.tianyancha.com/company/191512139
安徽达诺乳业有限公司,0,https://www.tianyancha.com/company/3031210055
安徽迅启蓄电池有限公司,0,https://www.tianyancha.com/company/190050206
安徽迈思特轴承有限公司,0,https://www.tianyancha.com/company/189884899
安徽运通汽配有限公司,2,-
安徽省通达包装材料有限公司,0,https://www.tianyancha.com/company/498895554
安徽都邦电器有限公司,0,https://www.tianyancha.com/company/187290594
安徽野岭饮料食品有限公司,1,-
安徽金光机械股份有限公司,1,-
安徽金农饲料有限公司,0,https://www.tianyancha.com/company/186231322
安徽金冠玻璃有限公司,0,https://www.tianyancha.com/company/366542214
安徽金太阳生化药业有限公司,0,https://www.tianyancha.com/company/420525606
安徽金寨将军磁业有限公司,0,https://www.tianyancha.com/company/549362016
安徽金寨金燕桑茧丝绸有限公司,0,https://www.tianyancha.com/company/390750590
安徽省金寨县齐发栗业有限公司,0,https://www.tianyancha.com/company/509089530
安徽金梦源纺织制品有限公司,0,https://www.tianyancha.com/company/396695083
安徽省金正塑业有限公司,0,https://www.tianyancha.com/company/542375600
安徽金泰农药化工有限公司,0,https://www.tianyancha.com/company/797129085
安徽金种子集团有限公司,0,https://www.tianyancha.com/company/309187879
安徽省金编塑业有限公司,0,https://www.tianyancha.com/company/186129726
安徽金蓼复合磁化肥有限公司,0,https://www.tianyancha.com/company/550281403
安徽金阳环保肥业有限公司,1,-
安徽省鑫和纺织有限公司,0,https://www.tianyancha.com/company/512854051
安徽鑫晔体育用品有限公司,1,-
安徽鑫科新材料股份有限公司,0,https://www.tianyancha.com/company/364288921
安徽鑫龙低压电器有限公司,0,https://www.tianyancha.com/company/638382224
安徽鑫龙电器股份有限公司,0,https://www.tianyancha.com/company/22676356
安徽鑫龙自动化有限公司,0,https://www.tianyancha.com/company/627601259
安徽钟南电器有限公司,1,-
安徽铁鹏海豹水泥有限公司,0,https://www.tianyancha.com/company/471346543
安徽铜泉电线电缆有限公司,0,https://www.tianyancha.com/company/502368972
安徽省铜陵泰成实业有限公司,0,https://www.tianyancha.com/company/657179678
安徽铜陵海螺水泥有限公司,0,https://www.tianyancha.com/company/569587854
安徽省锦翔塑编包装实业有限公司,0,https://www.tianyancha.com/company/3222788290
安徽长丰海螺水泥有限公司,0,https://www.tianyancha.com/company/422670360
安徽省长兴工艺玩具集团有限公司,0,https://www.tianyancha.com/company/691783313
安徽长安专用汽车制造有限公司,1,-
安徽长江机床制造（集团）有限公司,0,https://www.tianyancha.com/company/923185618
安徽省长江矿业有限公司,0,https://www.tianyancha.com/company/730469748
安徽省阜南县化工总厂,1,-
安徽阜阳华源纺织有限公司,0,https://www.tianyancha.com/company/487892887
安徽省阜阳同力实业有限公司,0,https://www.tianyancha.com/company/79822128
安徽省阜阳市宏洋实业有限公司,0,https://www.tianyancha.com/company/492091984
安徽省阜阳市植物油厂,0,https://www.tianyancha.com/company/510027763
安徽省阜阳市瑞华纺织品有限公司,0,https://www.tianyancha.com/company/2320433879
安徽阳光纸业有限公司,1,-
安徽阳光面粉有限公司,2,-
安徽阿幸食品有限公司,0,https://www.tianyancha.com/company/388065938
安徽隆平高科种业有限公司,0,https://www.tianyancha.com/company/443852159
安徽省雪枫制药厂,1,-
安徽省雪润肉食品有限公司,0,https://www.tianyancha.com/company/486898103
安徽霍山亚力包装材料有限公司,0,https://www.tianyancha.com/company/348645209
安徽省霍山县富邦竹业有限公司,0,https://www.tianyancha.com/company/471602068
安徽霍山科皖特种铸造有限公司,0,https://www.tianyancha.com/company/509614499
安徽露仙调味食品有限公司,1,-
安徽青松工具有限公司,0,https://www.tianyancha.com/company/571083089
安徽青阳宝宏矿业有限公司,0,https://www.tianyancha.com/company/655640863
安徽省青阳县方兴实业有限公司,0,https://www.tianyancha.com/company/2347400015
安徽省青阳县春诚汽车配件有限公司,0,https://www.tianyancha.com/company/566570929
安徽省青阳县秋田木业有限公司,2,-
安徽顶大食品有限公司,0,https://www.tianyancha.com/company/418494261
安徽颐生堂中药饮片有限公司,0,https://www.tianyancha.com/company/510942651
安徽飞达消防设备工程有限公司,0,https://www.tianyancha.com/company/764409764
安徽马钢比亚西钢筋焊网有限公司,0,https://www.tianyancha.com/company/512895206
安徽高山药业有限公司,0,https://www.tianyancha.com/company/533955717
安徽鲁班钢构有限公司,0,https://www.tianyancha.com/company/526027979
安徽鸿凌机电仪表（集团）有限公司,0,https://www.tianyancha.com/company/173093546
安徽省鸿庆精机有限公司,0,https://www.tianyancha.com/company/3091412867
安徽鸿汇食品集团有限公司,2,-
安徽黄山电器总厂,1,-
安徽省黄山市轴承有限公司,2,-
安徽鼎辉玩具有限公司,0,https://www.tianyancha.com/company/436506311
安徽龙波电气有限公司,0,https://www.tianyancha.com/company/487357849
安徽龙溪外贸麻油制造有限公司,0,https://www.tianyancha.com/company/1102693189
安徽龙科马生物制药有限公司,0,https://www.tianyancha.com/company/538005465
安思爱（上海）服饰有限公司,0,https://www.tianyancha.com/company/1425793350
安悦电子（深圳）有限公司,1,-
安捷伦科技（上海）有限公司,0,https://www.tianyancha.com/company/739540574
安捷利（番禺）电子实业有限公司,0,https://www.tianyancha.com/company/1532068999
安捷资讯科技（苏州）有限公司,0,https://www.tianyancha.com/company/2351738988
安斯泰来制药（中国）有限公司,0,https://www.tianyancha.com/company/1051020875
安新县泰发皮革有限公司,0,https://www.tianyancha.com/company/445272932
安新县裕达毛毯纺织有限公司,0,https://www.tianyancha.com/company/445249838
安施电子（天津）有限公司,0,https://www.tianyancha.com/company/220225996
安柏家庭用品（深圳）有限公司,0,https://www.tianyancha.com/company/2350098342
安泰（德清）时装有限公司,0,https://www.tianyancha.com/company/1167680288
安泰科技股份有限公司,0,https://www.tianyancha.com/company/640320
安泽县东宝洗煤厂,0,https://www.tianyancha.com/company/340803834
安溪佳诚工艺品有限公司,0,https://www.tianyancha.com/company/251561097
安溪新唐信家俱有限公司,0,https://www.tianyancha.com/company/797453875
安溪县英发家具装饰有限公司,0,https://www.tianyancha.com/company/764302989
安溪县贤发工艺制品有限公司,0,https://www.tianyancha.com/company/737934590
安特优发动机工程（苏州）有限公司,0,https://www.tianyancha.com/company/2316435374
安特固化学（无锡）有限公司,1,-
安特（惠州）工业有限公司,0,https://www.tianyancha.com/company/1663020686
安特精密机械（上海）有限公司,0,https://www.tianyancha.com/company/2341317349
安特（苏州）精密机械有限公司,0,https://www.tianyancha.com/company/2349763826
