企业名称,状态,网址
平远友邦木业有限公司,0,https://www.tianyancha.com/company/440628686
平远县恒明汽车底盘制造有限公司,0,https://www.tianyancha.com/company/1432476203
平远县横龙木业有限公司,1,-
平远县碧海水电营运有限公司,0,https://www.tianyancha.com/company/1120579600
平远县裕兴万年水泥实业有限公司,0,https://www.tianyancha.com/company/697048459
平邑县万庄膏业有限公司,0,https://www.tianyancha.com/company/416219634
平邑县丰源有限公司,0,https://www.tianyancha.com/company/416147977
平邑县伟力起重机械有限公司,1,-
平邑县供电公司,1,-
平邑县大洋塑料编织有限公司,1,-
平邑县宏峰石材有限公司,0,https://www.tianyancha.com/company/2337375258
平邑县宏达食品有限公司,0,https://www.tianyancha.com/company/2320549011
平邑县泰丰石材有限公司,0,https://www.tianyancha.com/company/663777356
平邑县瑞丰石膏制品有限公司,0,https://www.tianyancha.com/company/2337374238
平邑精工齿轮有限公司,1,-
平邑县金利合线有限公司,0,https://www.tianyancha.com/company/494890217
平邑金太阳纸业有限公司,0,https://www.tianyancha.com/company/361460041
平邑县铜石选厂,0,https://www.tianyancha.com/company/1295827646
平阳县万利达塑料厂,0,https://www.tianyancha.com/company/871960263
平阳世一变速机械实业有限公司,0,https://www.tianyancha.com/company/684345542
平阳县东风皮塑工艺厂,1,-
平阳县信业水产有限公司,0,https://www.tianyancha.com/company/1434763790
平阳县八达包装有限公司,0,https://www.tianyancha.com/company/1464043525
平阳县兴隆塑料厂,0,https://www.tianyancha.com/company/1401678116
平阳县化工机械总厂,0,https://www.tianyancha.com/company/1395473515
平阳县华威塑料厂,0,https://www.tianyancha.com/company/1428264519
平阳县南方塑料厂,0,https://www.tianyancha.com/company/2777699497
平阳县南麂岛开发有限公司,0,https://www.tianyancha.com/company/1415409717
平阳县塑料七厂,0,https://www.tianyancha.com/company/136749289
平阳县塑料八厂,0,https://www.tianyancha.com/company/72113995
平阳县塑料十六厂,0,https://www.tianyancha.com/company/611242116
平阳县外贸包装厂,1,-
平阳县大哥大塑革厂,0,https://www.tianyancha.com/company/43418524
平阳县孔迎宠物用品有限公司,0,https://www.tianyancha.com/company/52581442
平阳县安达电机公司,0,https://www.tianyancha.com/company/764500018
平阳县宏利经贸实业公司,0,https://www.tianyancha.com/company/1193559796
平阳县宏发皮革有限公司,0,https://www.tianyancha.com/company/1177809858
平阳县宏翔塑料有限公司,0,https://www.tianyancha.com/company/665862707
平阳县宠物玩具实业公司,1,-
平阳县振阳饲料有限公司,0,https://www.tianyancha.com/company/80580508
平阳县新兴塑料圆织厂,0,https://www.tianyancha.com/company/78350604
平阳县晨阳塑料包装厂,0,https://www.tianyancha.com/company/503354074
平阳县欣欣编织厂,0,https://www.tianyancha.com/company/2317119144
平阳县水头自来水厂,1,-
平阳县汇通塑编有限公司,0,https://www.tianyancha.com/company/1381273383
平阳县海星纸张有限公司,1,-
平阳县环宇包装厂,0,https://www.tianyancha.com/company/764696574
平阳县自动塑料机织二厂,0,https://www.tianyancha.com/company/613563084
平阳县荣华皮件有限公司,0,https://www.tianyancha.com/company/1728284748
平阳县远大皮革有限公司,0,https://www.tianyancha.com/company/79633415
平阳县钱仓五金工艺冲压厂,0,https://www.tianyancha.com/company/431693473
平阳县银兴塑业有限公司,0,https://www.tianyancha.com/company/1428664279
平阳县锦华宠物用品有限公司,0,https://www.tianyancha.com/company/1216680890
平阴县供电公司,1,-
平阴建昌机械制造厂,2,-
平阴玫瑰开发有限公司,0,https://www.tianyancha.com/company/2321258013
平阴县胡庄制修厂,0,https://www.tianyancha.com/company/2310442198
平阴县金城化工厂,0,https://www.tianyancha.com/company/3202103440
平陆县同鑫磨料有限公司,0,https://www.tianyancha.com/company/287309803
平顶山市东鑫焦化有限公司,0,https://www.tianyancha.com/company/80296999
平顶山中选自控系统有限公司,0,https://www.tianyancha.com/company/444300206
平顶山市华辰供电有限公司,0,https://www.tianyancha.com/company/3388688325
平顶山市华辰石龙区供电有限公司,0,https://www.tianyancha.com/company/3385831508
平顶山市卫东区东高皇乡东联二矿二井,2,-
平顶山市卫东定点肉类加工厂,0,https://www.tianyancha.com/company/889993484
平顶山市天广集团总公司,2,-
平顶山市奎星调味品厂,0,https://www.tianyancha.com/company/340573286
平顶山市奥思达化学助剂厂,1,-
平顶山姚孟发电有限公司,0,https://www.tianyancha.com/company/2345134411
平顶山姚孟电力集团有限公司,1,-
平顶山巨源焦化有限公司,0,https://www.tianyancha.com/company/142009569
平顶山市平西水泥厂,1,-
平顶山市新华区四矿,0,https://www.tianyancha.com/company/431233817
平顶山市新华区焦店镇大杨玻璃公司,2,-
平顶山市新华第一洗煤厂,0,https://www.tianyancha.com/company/889971285
平顶山日报印刷厂,0,https://www.tianyancha.com/company/1099850447
平顶山明晟服饰有限公司,1,-
平顶山正大有限公司,0,https://www.tianyancha.com/company/314650860
平顶山市水泥厂润丰公司,2,-
平顶山市汇源化学工业公司,1,-
平顶山市海德化工有限公司,0,https://www.tianyancha.com/company/2320253369
平顶山市湛河区山庄煤矿,1,-
平顶山市福利洗煤厂,0,https://www.tianyancha.com/company/2335092106
平顶山市纺纱厂,0,https://www.tianyancha.com/company/1496719116
平顶山市绝缘制品有限公司,2,-
平顶山市自来水公司,0,https://www.tianyancha.com/company/2315946018
平顶山市迪可食品有限公司,2,-
平顶山市金牛足食品有限公司,0,https://www.tianyancha.com/company/1673438843
平顶山市鑫达机电有限公司,0,https://www.tianyancha.com/company/446401258
平顶山铁路机械修配厂,2,-
平顶山市食品机械厂,1,-
平顶山市高压福利机械厂,0,https://www.tianyancha.com/company/2317342422
平顶山市鲁山亚星炭素材料有限公司,0,https://www.tianyancha.com/company/861682098
平顺县祥龙矿业有限公司,0,https://www.tianyancha.com/company/286633729
幸亚（苏州）电子工业有限公司,0,https://www.tianyancha.com/company/2349499157
幸叶电子（苏州）有限公司,1,-
幸星（南京）数码有限公司,0,https://www.tianyancha.com/company/2349177829
广上科技（广州）有限公司,0,https://www.tianyancha.com/company/2335846428
广东省401厂,2,-
广东一方制药有限公司,0,https://www.tianyancha.com/company/224606274
广东一禾药业有限公司,0,https://www.tianyancha.com/company/1566837654
广东七建集团管桩基础有限公司,0,https://www.tianyancha.com/company/1240420374
广东七建集团管桩工程有限公司,0,https://www.tianyancha.com/company/2337659774
广东万家乐燃气具有限公司,0,https://www.tianyancha.com/company/669314188
广东万家乐电缆有限公司,0,https://www.tianyancha.com/company/2320584971
广东万家达家用电器有限公司,0,https://www.tianyancha.com/company/2323997524
广东万年青制药有限公司,0,https://www.tianyancha.com/company/3219844236
广东万昌印刷包装有限公司,0,https://www.tianyancha.com/company/305802108
广东万盛实业有限公司,0,https://www.tianyancha.com/company/1335437421
广东万绿宝食品有限公司,0,https://www.tianyancha.com/company/2348374768
广东万联包装机械有限公司,0,https://www.tianyancha.com/company/3094250199
广东万里马投资实业有限公司,0,https://www.tianyancha.com/company/2332205140
广东三A不锈钢制品集团有限公司,0,https://www.tianyancha.com/company/509267057
广东省三A水泥有限公司,0,https://www.tianyancha.com/company/1269685881
广东三井汽车配件有限公司,0,https://www.tianyancha.com/company/491831093
广东三凌塑料管材有限公司,0,https://www.tianyancha.com/company/880577620
广东三水大鸿制釉有限公司,0,https://www.tianyancha.com/company/740708646
广东省三水盐矿联合开发公司,0,https://www.tianyancha.com/company/1549458738
广东三洋空调机有限公司,1,-
广东世信药业有限公司,0,https://www.tianyancha.com/company/1405659321
广东东圃市政混凝土有限公司,0,https://www.tianyancha.com/company/2321440856
广东东宝集团有限公司,0,https://www.tianyancha.com/company/209387448
广东东方电讯科技有限公司,0,https://www.tianyancha.com/company/198950265
广东东方管业有限公司,0,https://www.tianyancha.com/company/2317884744
广东东泰乳业有限公司,0,https://www.tianyancha.com/company/1433745071
广东省东莞电机有限公司,0,https://www.tianyancha.com/company/533819598
广东东菱凯琴集团有限公司,0,https://www.tianyancha.com/company/361127461
广东东钢实业有限公司,2,-
广东中兴液力传动有限公司,0,https://www.tianyancha.com/company/1300624051
广东中宝联合电缆有限公司,0,https://www.tianyancha.com/company/1389255612
广东中宝食品容器有限公司,1,-
广东中山爱美高特种化工有限公司,1,-
广东中成化工股份有限公司,0,https://www.tianyancha.com/company/2399727447
广东中润钢铁实业有限公司,1,-
广东中环真空设备有限公司,0,https://www.tianyancha.com/company/2322573120
广东中电华强变压器有限公司,0,https://www.tianyancha.com/company/1241258993
广东中艺重工有限公司,0,https://www.tianyancha.com/company/1377325458
广东中铁建工机械有限公司,0,https://www.tianyancha.com/company/2324201757
广东省丰收糖业发展有限公司,0,https://www.tianyancha.com/company/385972727
广东省乐昌市粤北化工有限公司,2,-
广东乔美集团有限公司,0,https://www.tianyancha.com/company/1466379224
广东省九江酒厂有限公司,0,https://www.tianyancha.com/company/1257450809
广东云山汽车厂,0,https://www.tianyancha.com/company/777129696
广东五联木业集团有限公司,0,https://www.tianyancha.com/company/1342023634
广东井得电机有限公司,0,https://www.tianyancha.com/company/3300251130
广东亚仿科技股份有限公司,0,https://www.tianyancha.com/company/293081187
广东亿讯电子有限公司,0,https://www.tianyancha.com/company/1376256279
广东仕诚塑料机械有限公司,0,https://www.tianyancha.com/company/1675085670
广东众利鞋业有限公司,0,https://www.tianyancha.com/company/787861108
广东众生药业股份有限公司,0,https://www.tianyancha.com/company/375018460
广东省会江实业公司,0,https://www.tianyancha.com/company/608934877
广东伟业铝厂有限公司,1,-
广东传丰复合肥厂有限公司,0,https://www.tianyancha.com/company/1312611178
广东省佛山市南海水泥厂,0,https://www.tianyancha.com/company/1717011052
广东省佛山市南海区道明化工一厂,1,-
广东省佛山水泵厂有限公司,0,https://www.tianyancha.com/company/2325112730
广东佳宝集团有限公司,0,https://www.tianyancha.com/company/586697000
广东佳彩数码科技有限公司,0,https://www.tianyancha.com/company/521921173
广东佳明机器有限公司,0,https://www.tianyancha.com/company/1619746806
广东信宁工艺玩具厂,0,https://www.tianyancha.com/company/1730289894
广东信强混凝土有限公司,0,https://www.tianyancha.com/company/1625626932
广东信源彩色印务有限公司,0,https://www.tianyancha.com/company/4034962967
广东信源物流设备有限公司,0,https://www.tianyancha.com/company/1387107702
广东省假肢康复中心,0,https://www.tianyancha.com/company/3097108569
广东全福陶瓷实业有限公司,0,https://www.tianyancha.com/company/859245017
广东兰昌实业总公司,0,https://www.tianyancha.com/company/1399340781
广东省兴宁市橡胶厂,2,-
广东兴宁电机厂有限公司,0,https://www.tianyancha.com/company/1389117744
广东省兴宁市第一染织厂,1,-
广东省兴龙实业公司,0,https://www.tianyancha.com/company/2335579435
广东养宝生物制药有限公司,0,https://www.tianyancha.com/company/2317230921
广东省农垦总局印刷厂,1,-
广东冠华饲料实业有限公司,0,https://www.tianyancha.com/company/2322409179
广东凌霄泵业股份有限公司,0,https://www.tianyancha.com/company/437248453
广东凤凰饲料有限公司,0,https://www.tianyancha.com/company/859172838
广东凤铝铝业有限公司,0,https://www.tianyancha.com/company/445243763
广东则良蓄电池有限公司,1,-
广东利凯尔实业有限公司,0,https://www.tianyancha.com/company/859142831
广东力士通机械股份有限公司,0,https://www.tianyancha.com/company/680943276
广东加多宝饮料食品有限公司,0,https://www.tianyancha.com/company/2318039047
广东加大实业有限公司,0,https://www.tianyancha.com/company/1539826230
广东省化州市毛纺织厂,0,https://www.tianyancha.com/company/1362722369
广东省化州市麻纺织厂,2,-
广东省北江工业总厂,0,https://www.tianyancha.com/company/1413227092
广东北电通信设备有限公司,1,-
广东千色花化工有限公司,0,https://www.tianyancha.com/company/1410997913
广东半球实业集团公司,0,https://www.tianyancha.com/company/531272926
广东华业包装材料有限公司,0,https://www.tianyancha.com/company/423199832
广东省华侨铝制品厂,0,https://www.tianyancha.com/company/404993842
广东华信英锋电子有限公司,1,-
广东华力通变压器有限公司,0,https://www.tianyancha.com/company/1313117952
广东华成皮革有限公司,0,https://www.tianyancha.com/company/1577917803
广东华捷钢管实业有限公司,0,https://www.tianyancha.com/company/1342626991
广东华昌铝厂有限公司,0,https://www.tianyancha.com/company/420622373
广东华普电器实业集团有限公司,0,https://www.tianyancha.com/company/107588369
广东华歌尔时装有限公司,0,https://www.tianyancha.com/company/1568829968
广东省华海糖业发展有限公司华丰分公司,1,-
广东华润涂料有限公司,0,https://www.tianyancha.com/company/1378470808
广东华英企业有限公司,0,https://www.tianyancha.com/company/1288707007
广东华金合金材料实业有限公司,0,https://www.tianyancha.com/company/2353549529
广东华隆文具有限公司,0,https://www.tianyancha.com/company/28977129
广东南丰电气自动化有限公司,0,https://www.tianyancha.com/company/1399329451
广东南国药业有限公司,0,https://www.tianyancha.com/company/1598139366
广东南方制碱有限公司,0,https://www.tianyancha.com/company/515083384
广东南方宏明电子科技股份有限公司,0,https://www.tianyancha.com/company/366382439
广东省南方彩色制版有限公司,0,https://www.tianyancha.com/company/1255296473
广东省南方水泥厂,0,https://www.tianyancha.com/company/2324680379
广东南海中宏饲料厂,0,https://www.tianyancha.com/company/2344077018
广东省南海化工总厂有限公司,0,https://www.tianyancha.com/company/848488103
广东博华陶瓷有限公司,0,https://www.tianyancha.com/company/1405908644
广东博奇香料集团有限公司,2,-
广东省博罗园洲勤达印务有限公司,2,-
广东卫伦生物制药有限公司,0,https://www.tianyancha.com/company/255991295
广东友钢钢铁有限公司,0,https://www.tianyancha.com/company/744180678
广东省双龙水泥厂,0,https://www.tianyancha.com/company/2320430940
广东可普汽车配件有限公司,0,https://www.tianyancha.com/company/2316284863
广东可耐福新型建筑材料有限公司,0,https://www.tianyancha.com/company/1255404988
广东省台山市凯明电镀厂有限公司,0,https://www.tianyancha.com/company/661654631
广东省台山市新宁制药厂,1,-
广东台山标信制衣厂,2,-
广东省台山市玻璃工艺厂,1,-
广东台山科艺实业有限公司,0,https://www.tianyancha.com/company/2320566752
广东台山纺织实业有限公司,0,https://www.tianyancha.com/company/2322099842
广东省吉荣空调设备公司,1,-
广东吉青电缆实业有限公司,0,https://www.tianyancha.com/company/1609465411
广东同享食品有限公司,0,https://www.tianyancha.com/company/853105256
广东省向荣企业公司,0,https://www.tianyancha.com/company/1399243475
广东吴川富强网业有限公司,0,https://www.tianyancha.com/company/2323547570
广东省和洋包装材料有限公司,0,https://www.tianyancha.com/company/1293474604
广东哈奇食品有限公司,0,https://www.tianyancha.com/company/2951113589
广东响石数码科技有限公司,0,https://www.tianyancha.com/company/1309841547
广东省嘉应机械厂,1,-
广东嘉意洋服有限公司,0,https://www.tianyancha.com/company/1248287843
广东嘉陵摩托车有限公司,1,-
广东四会互感器厂有限公司,0,https://www.tianyancha.com/company/786531476
广东省四会市时兴鞋厂,2,-
广东省四会石膏矿,0,https://www.tianyancha.com/company/2310118589
广东四明燕塘乳业有限公司,1,-
广东四通集团有限公司,0,https://www.tianyancha.com/company/3470258268
广东国光电子有限公司,0,https://www.tianyancha.com/company/1589324511
广东国医堂制药有限公司,0,https://www.tianyancha.com/company/873147132
广东国华粤电台山发电有限公司,0,https://www.tianyancha.com/company/103484188
广东国宾集团有限公司,0,https://www.tianyancha.com/company/544661214
广东国珠精密模具有限公司,0,https://www.tianyancha.com/company/1464930261
广东国通新型建材有限公司,1,-
广东圣都模具股份有限公司,0,https://www.tianyancha.com/company/3333095267
广东省地方国营澄海酒厂,2,-
广东省地方国营饶平糖厂,0,https://www.tianyancha.com/company/1309918267
广东省地方铁路增城双荔水泥有限公司,1,-
广东省地质矿产局探矿机械厂,0,https://www.tianyancha.com/company/1334988247
广东基础新世纪混凝土有限公司,0,https://www.tianyancha.com/company/2313103934
广东声威混凝土有限公司,0,https://www.tianyancha.com/company/1571867905
广东省多品种盐公司,1,-
广东多正化工科技有限公司,0,https://www.tianyancha.com/company/1545531649
广东多纳勒振华汽车系统有限公司,1,-
广东大业陶瓷有限公司,0,https://www.tianyancha.com/company/1422178641
广东大兴钢铁实业有限公司,0,https://www.tianyancha.com/company/582070306
广东大冢制药有限公司,0,https://www.tianyancha.com/company/1261952495
广东大冶摩托车技术有限公司,0,https://www.tianyancha.com/company/1411839370
广东省大宝山矿业有限公司,0,https://www.tianyancha.com/company/1436716848
广东大德特种纸业有限公司,0,https://www.tianyancha.com/company/1363662302
广东大洋食品有限公司,0,https://www.tianyancha.com/company/437408841
广东大福摩托车有限公司,0,https://www.tianyancha.com/company/1406975306
广东大顶矿业股份有限公司,0,https://www.tianyancha.com/company/730304183
广东天乐通信设备有限公司,0,https://www.tianyancha.com/company/442177523
广东省天井山林场,0,https://www.tianyancha.com/company/793858777
广东天农食品有限公司,0,https://www.tianyancha.com/company/3465149336
广东天弼陶瓷有限公司,0,https://www.tianyancha.com/company/852635107
广东天普生化医药股份有限公司,0,https://www.tianyancha.com/company/1142274481
广东省天河羊毛衫织造厂,0,https://www.tianyancha.com/company/2323270873
广东天邦饲料科技有限公司,0,https://www.tianyancha.com/company/1451590116
广东天际电器有限公司,2,-
广东太古可口可乐有限公司,0,https://www.tianyancha.com/company/1247212550
广东太阳神集团有限公司,0,https://www.tianyancha.com/company/86815857
广东奔朗超硬材料制品有限公司,2,-
广东省委办公厅印刷厂,1,-
广东威华股份有限公司,0,https://www.tianyancha.com/company/391171885
广东威士雅保健品有限公司,0,https://www.tianyancha.com/company/3470773299
广东安柏服饰实业有限公司,0,https://www.tianyancha.com/company/852524705
广东安飞汽车配件有限公司,0,https://www.tianyancha.com/company/2329154665
广东宏兴机械有限公司,0,https://www.tianyancha.com/company/2317410607
广东宏兴集团股份有限公司,0,https://www.tianyancha.com/company/535304262
广东宏华集团有限公司,0,https://www.tianyancha.com/company/3149952753
广东宏远集团药业有限公司,0,https://www.tianyancha.com/company/366702944
广东宗宗首饰制造有限公司,0,https://www.tianyancha.com/company/439185318
广东宝丽华服装有限公司,0,https://www.tianyancha.com/company/417238496
广东宝丽华电力有限公司,0,https://www.tianyancha.com/company/1373920728
广东宝力电器有限公司,0,https://www.tianyancha.com/company/439332865
广东省宝月经济发展总公司,0,https://www.tianyancha.com/company/1224219133
广东省宝鼎不锈钢制品有限公司,0,https://www.tianyancha.com/company/1538406049
广东家能现代厨具有限公司,0,https://www.tianyancha.com/company/852258831
广东富兴摩托车实业有限公司,0,https://www.tianyancha.com/company/494189861
广东富华工程机械制造有限公司,1,-
广东省封开县石料厂,0,https://www.tianyancha.com/company/3111951364
广东小老谢食品有限公司,0,https://www.tianyancha.com/company/1252888885
广东尼康照相机有限公司,1,-
广东山河集团有限公司,0,https://www.tianyancha.com/company/1329644295
广东岭南为多生命高科有限公司,2,-
广东岭南厨具有限公司,0,https://www.tianyancha.com/company/1368375283
广东巴德士化工有限公司,0,https://www.tianyancha.com/company/32385079
广东希恩卫浴实业有限公司,0,https://www.tianyancha.com/company/1609807365
广东广信青洲水泥有限公司,0,https://www.tianyancha.com/company/1536630840
广东省广宁县船用水泵制造有限公司,2,-
广东省广州石油机械厂,0,https://www.tianyancha.com/company/1324926044
广东省广弘九江饲料有限公司,0,https://www.tianyancha.com/company/692371197
广东广彩印务有限公司,0,https://www.tianyancha.com/company/3024842922
广东广液实业股份有限公司,0,https://www.tianyancha.com/company/1575452049
广东广船国际电梯有限公司,0,https://www.tianyancha.com/company/3409904948
广东康宝电器有限公司,0,https://www.tianyancha.com/company/851829419
广东康尼沛克制衣有限公司,0,https://www.tianyancha.com/company/1411741115
广东康盈交通设备制造有限公司,0,https://www.tianyancha.com/company/355207633
广东康美药业股份有限公司,0,https://www.tianyancha.com/company/26422602
广东廉江市新恒通建材有限公司,2,-
广东省建筑机械厂,0,https://www.tianyancha.com/company/2316089875
广东开平金亿胶囊有限公司,0,https://www.tianyancha.com/company/1452453637
广东开盛钢铁实业有限公司,0,https://www.tianyancha.com/company/2318727642
广东强辉陶瓷有限公司,0,https://www.tianyancha.com/company/851082428
广东彩艳股份有限公司,0,https://www.tianyancha.com/company/484649990
广东彼迪药业有限公司,0,https://www.tianyancha.com/company/775090124
广东省徐闻三和发展有限公司,2,-
广东省徐闻盐场,0,https://www.tianyancha.com/company/1260488226
广东得胜电子有限公司,0,https://www.tianyancha.com/company/2320475756
广东德冠包装材料有限公司,0,https://www.tianyancha.com/company/678300447
广东德和通信设备有限公司,0,https://www.tianyancha.com/company/850953392
广东省德庆县德城镇康州工艺厂,2,-
广东德庆无比养生酒业有限公司,0,https://www.tianyancha.com/company/2320529774
广东省德庆县自来水公司,1,-
广东省德庆县风机厂,2,-
广东德康化工实业有限公司,0,https://www.tianyancha.com/company/858538580
广东德怡电子科技有限公司,0,https://www.tianyancha.com/company/1340936661
广东德美精细化工股份有限公司,0,https://www.tianyancha.com/company/3029465785
广东德豪润达电气股份有限公司,0,https://www.tianyancha.com/company/3378617127
广东德隆有机生物肥料厂,0,https://www.tianyancha.com/company/1242094137
广东必达保安系统有限公司,0,https://www.tianyancha.com/company/5488419
广东必达电器有限公司,0,https://www.tianyancha.com/company/345849289
广东志达纺织装饰有限公司,0,https://www.tianyancha.com/company/296119239
广东志高空调有限公司,0,https://www.tianyancha.com/company/79624967
广东怀集威发水电有限公司,0,https://www.tianyancha.com/company/1582222790
广东怀集新联水电有限公司,0,https://www.tianyancha.com/company/1719201296
广东恒光电器有限公司,0,https://www.tianyancha.com/company/1351276486
广东恒基皮具有限公司,1,-
广东恒基金属制品实业有限公司,0,https://www.tianyancha.com/company/436412591
广东恒联食品机械有限公司,0,https://www.tianyancha.com/company/837723921
广东恒诚制药有限公司,0,https://www.tianyancha.com/company/3287828662
广东恒运电机有限公司,0,https://www.tianyancha.com/company/850777871
广东恒骏工贸发展有限公司,0,https://www.tianyancha.com/company/1472876434
广东恒龙香料化工有限公司,0,https://www.tianyancha.com/company/1411661841
广东省惠东县水泥二厂,0,https://www.tianyancha.com/company/4457217940
广东惠东县胭脂红鞋业有限公司,2,-
广东惠而浦家电制品有限公司,0,https://www.tianyancha.com/company/1270123443
广东成泰米业有限公司,0,https://www.tianyancha.com/company/1419854559
广东振华电器有限公司,0,https://www.tianyancha.com/company/1435253401
广东省揭西县白云山威灵药业有限公司,2,-
广东摩天食品有限公司,0,https://www.tianyancha.com/company/778231397
广东教学仪器厂,0,https://www.tianyancha.com/company/850288028
